sentence,emotion
"""Your tibialis anterior is damaged.""",fear
"""Sadly, he's in the West.""",sadness
"""Sorry.""",sadness
"""It's just a joke.""",joy
"""It's nice to see you again, Rainie.""",joy
Uh oh. I smell trouble.,fear
"Then all of a sudden, I sensed an incredible amount of pressure and all of us summoned and drew our weapons, pointing them to each other, then the table and chairs were suddenly frozen.",fear
"""No. You sound like your dad—a leader.""",joy
"That place is too quiet that I tend to hear a lot of buzzing and humming, plus the tension in the surrounding is too high.",fear
"""Of course. Her team successfully infiltrated the Shinigami's base and retrieved her comrades' eyes.""",joy
"""That's great.""",joy
"""I see. I guess there's no need to worry about you.""",joy
"""Thanks for this, by the way. It warms me up since we're living on a cold place.""",joy
"""Nice. I didn't even notice it,"" then he tossed it to Reiji and he caught it.",joy
"""That it's dangerous. She's worried about us.""",fear
"""Don't let go,"" Hiro said. And the next thing I knew, the Black Dimension was already closing and I saw the pain in his expression.",fear
"""You almost died.""",fear
"She lost her husband and dearest friends, and she didn't see her son for fifteen years.",sadness
"""What did you do? Two of your fatal points are in dire state.""",fear
"""N-no way. My eyes are not that...""",fear
They are in trouble.,fear
I can hear the two of them cursing inside their head while heading to the building in front of them.,anger
I smiled triumphantly. I fulfilled my role.,joy
But I don't think I can last any longer because all of them lunged at me.,sadness
These Shinigamis are going to kill me.,fear
"""What the hell is this creepy feeling?""",fear
"""One more word and I'll behead you.""",anger
"""If you could, old hag.""",anger
"""You're going with us, whether you like it or not.""",anger
I have a bad feeling about this.,fear
"""Go all out. Erase this place where she suffered a lot.""",anger
"""Chase him!""",anger
"""I won't let you touch him,"" I whispered as I released the arrow from the bow.",anger
It hit the back of the Shinigami and Darwin looked at me with a proud expression.,joy
"As I was looking at my father taking down the building, I felt a sense of relief and sadness. Seeing his actions, I know that he wanted to do this after all this time. He wanted to erase this place where my mother suffered.",sadness
"""Yeah. I'm scared to know the truth.""",fear
"""I really admire you, Mama. You're so strong. And even if nobody's talking about you here because they said you were a curse, you will always be my hero. It's just sad that you're not here anymore.""",sadness
"""She died in his arms.""",sadness
"""I don't know,"" he said and I saw the sadness in his eyes. ""These past few months, I've been recollecting some unfamiliar memories.""",sadness
"""But remembering is just as worse as forgetting.""",sadness
"""His cries filled the place.""",sadness
"""Still unstable but we're recovering. Thanks to all of you.""",joy
"""Wow. Thank you, Darwin. I'm going to use this.""",joy
I'm glad that it didn't turn out that way. I still have him at my side.,joy
"""I'm back, Vince,"" I whispered as I caressed his grave.",sadness
His death still haunts me and gives me nightmares.,sadness
"""Even though a lot of things happened, I'm glad that I still have the both of you,"" I said while keeping my tears from falling. ""So please...don't you ever dare to die on me, too.""",sadness
Coming back here and being with them made those memories vivid. If I could only rewind the time we were the happiest... If I could only stop the time once again...,sadness
"However, after hearing his thoughts, I felt sad and hurt because he's starting to remember the war fifteen years ago when he was just a one-year old baby. Maybe subconsciously, he pushed them away to the depths of his mind but the second war triggered them to resurface.",sadness
"""He chose to protect you. He did everything to save our future so instead of being sorry, be thankful to your father. Will you do that for me, Nathan?""",sadness
My tears fell as I remember our happy moments together and I feel miserable because all these memories keep coming back...but he never does. And he never will.,sadness
"""Tss. I want to get out of this place immediately. Why do I have to be with these people? I'm going to kick that old fart's ass when I get back.""",anger
"""N-No, sir.""",fear
"""Damn you, old fart, are you playing with me?!""",anger
"""Well, being curious isn't bad.""",joy
Wow. That's handy but a bit sad. Will he also forget people after a long time? Will his memories fade away?,sadness
"""You look so confident and calculating outside but deep inside, you're anxious and insecure of yourself.""",sadness
"""Sir Eiichi!"" I squeaked and he just smiled at me.",joy
"Beyond that, wild and vicious creatures freely roam around to serve as our external protection from unwelcomed visitors. However, we are not exempted from their attacks.",fear
"Without any warning, something monstrous charged towards me.",fear
I immediately jumped to the branches of the tree beside me and the creature banged its head straight to the bark. The tree shook tremendously and I almost fell directly to that thing.,fear
"His low growl made my skin crawl and when the moonlight illuminated the surroundings, my stomach tightened due to the creature's unsightly appearance.",fear
"Possessing a broad and long husk, it looks like a boar but the size of lion. Its jaws and teeth are those of a shark while its body is covered with sharp hairs. Looking at it for a few seconds made me nauseous and panic started to engulf my senses.",fear
"Just when I thought that one monster is enough to scare the heck out of me, two . . . three . . . six . . . six more appeared and surrounded us. Terror dominated my mind and body.",fear
"""Shit, I said stop it!"" Mitsuo shouted and he kneeled so that I can see him. ""These creatures can smell fear and they are attracted to it. If you don't want to attract more of them, calm yourself!""",anger
"""Let me hold this for a while,"" I breathed. ""Please."" He stayed silent but after a few seconds, he moved and positioned his back in front of me.",fear
"""Him?"" A taunting smile formed on her lips.",joy
Hearing the Council of Elders made my skin crawl. They are a group of advisers and counselors who help the leaders with their decisions and rules.,fear
Their loyalty to the tribe is absolute but that's also the reason why they are perceived as cold and heartless.,fear
"They will do anything to protect the Senshins and this place, even if it poses harm and danger to others.",fear
"""But I am not someone you can follow carelessly,"" he said with a serious tone and I can feel the goosebumps all over my body. The first thing that came into my mind is to escape but I don't want to be seen as a coward. Not by him.",fear
"I can see a huge, barren field, with crows, ravens and vultures flying around it. The sky was red because of the setting sun and it heightened the eerie scenery. I can also hear voices, some of them are angry and the others are wailing their hearts out. Standing in the middle of the field was an old man holding his weapon—a bardiche.",fear
"""Hey."" I stepped forward and slapped him hard. ""Call me anything but stupid because I am not."" After getting my fan from my side, I pointed it at him. ""Remember that and I hope it won't fade away from your memories.""",anger
"We both went quiet after that. I don't know what happened but after a few seconds, we smiled at each other. And this time, I know that something has changed between us.",joy
"""Thanks, Naomi,"" he said. ""I owe you one.""",joy
"""He's annoying. Calling me stupid and funny. Who is he anyway? Damn him.""",anger
"Even though she teased me nonstop a while ago, I smiled when I see her peaceful expression. Meeting with Koharu after a long time must have made her really happy.",joy
I was already on page 13 when I read that part and I was amazed because those chemicals can induce the emotion called love. The science part is interesting but I'm more excited to read the psychological interpretation of it.,joy
"""Love is dangerous, and is just next door to death.""",fear
"""Maybe coming here is a wrong decision after all. Damn it, old fart. This is all your fault.""",anger
"""So you heard it, huh?"" he calmly said and his tone was bone-chilling.",fear
"""Thank you,"" I said and he smiled in return.",joy
"I can't remember anything from my parents but my mother's favorite line: A person's memories can be seen clearly through his eyes. She's right, because right now, Mitsuo's memories flooded my own mind. A sea of blood, hundreds of corpses, people's cry all over the place, and him in the middle of all of that. Using all of my remaining mental strength, I shifted my gaze from his eyes to his wound, and I fell on my knees, panting heavily.",sadness
"""Yes and it's creepy.""",fear
"""You should learn from the expert,"" I said with confidence.",joy
"""So our theory is really true,"" I said, amazed by the words written on the books.",joy
We simultaneously called their names because their presence are too overwhelming to the point that it's already suffocating.,fear
"""Oohh. It has been a long time since you've been this distracted,"" Akira suddenly said and she looked at me with a taunting smile.",joy
"After reading that entry, Akemi and Mitsuo, with their menacing faces, appeared in my mind and I immediately shuddered. The thought of them being Shinigamis was too frightening and disturbing.",fear
"""It's better if you do not know,"" he said and his contemptuous smile frustrated me.",anger
"I was dead serious about that but he stared at me, as if I just said something ridiculous, and after a few seconds, he burst out laughing.",joy
Is this his concept of closure? I don't even know what he meant by this. I don't understand him and I don't like the feeling of being confused.,sadness
"""Forget about me,"" he said and I felt a twinge in my chest.",sadness
"""Please don't."" After hearing that, I felt hurt. For the first time, I was broken.",sadness
"I like him, I had admitted that, but I don't think it was right. Yes, he's a great and gentle person despite of his appearance and action but his memories . . . those thoughts that I have seen showed otherwise.",fear
"His glaring eyes, cunning smile, his clothes soaked in people's blood and the sword he was holding . . . his memories made me shudder in fear.",fear
I was thinking of a plan to subdue him but I immediately froze when I saw the body lying behind him. The guy's throat was slashed and his blood painted the park's cobblestones.,fear
"The murderer turned around and locked eyes with me. When I saw his scarred face, I almost stopped breathing.",fear
"I was paralyzed with fear and confusion but his raging, intense, green eyes showed no sympathy.",fear
"""Run away! Now! He's going to kill everyone!"" With much fear in my voice, and I wasn't faking it, my warning was effective. All of them scrambled away from the scene and after a few seconds, the guy, the dead body and me were the only ones left.",fear
"""You . . ."" He pointed at me again. ""You're like me! You can't deceive me!"" He roared with laughter that made my skin crawl but it was short-lived.",fear
He looked like a mad man and I was beyond scared. I reached for my fan but I went rigid when he hollered at me.,fear
"""You're the same as them!"" he roared and held the knife with both of his hands, aiming at my chest. ""You want to kill me! Die! Die!""",anger
"He turned around and when our eyes met, my body convulsed, as if the fear and panic I should've felt earlier took effect just now. He knelt in front of me and gently pulled me in for a hug.",fear
"I didn't know why but tears started falling from my eyes. I slapped his back because I was frustrated, confused and scared at the same time but he didn't complain. Instead, he pulled me closer.",sadness
"""And this is why I don't want you to get close to me,"" he breathed and I felt the thumping of his heart against his chest.",sadness
"""But I'm glad you're safe. I'm really glad and thankful.""",joy
"""Liar,"" I said between my sobs.",sadness
"Our conversation was suddenly cut off by loud thud and Akira's scream. When I turned around, Akemi was already laying unconscious on the floor.",fear
"Thank you, but I shouldn't be loved. I might hurt and break you so give your heart to someone who could really protect you. But your feelings toward me, I'll treasure it.",sadness
"Even though my senses were dwindling, I felt the tears running down my cheeks and I saw his agonizing smile. I wanted to say something but my voice betrayed me and those were the last words I heard before my consciousness slipped away.",sadness
"""They're gone,"" he said in a soft voice but his words resonated across the room. ""And they're not coming back anymore.""",sadness
"""So she's really a Shinigami,"" Akira said and she looked dejected.",sadness
"His retort made me smile a little and I saw his lips moving, too. I missed the way we tease each other and I'm glad that he can still think thoroughly even though we're in a rough situation.",joy
"""That place?"" He gave me a menacing smile that sent chills down my spine.",fear
I was about to move but then I felt a presence around me. My senses were heightened by the anxiety and I slowly readied my weapon. My body tensed when I heard a sinister laugh but the park remained deserted.,fear
"Suddenly, the hair on my nape tingled and someone spoke near my ear.",fear
"My whole body seared, as if I was thrown into the fire. I can't breathe properly and my senses were slowly fading.",fear
The Shinigami pulled my hair and his face came into view. I don't know if I was hallucinating but his face was full of scars that I can't distinguish his features anymore.,fear
The intensity of his gaze was enough to make me nauseous but his words stung me like a venom and I remembered the memory I have seen earlier.,fear
"My heart beat increased its pace and it felt like both of my adrenaline and serotonin levels heightened. Just when I needed a diversion from all of these feelings, he suddenly reached his gun and fired at the left side.",fear
"The voice behind me sent shivers down my spine and the only thing I could do was using my sixth sense. I managed to stop the time around me but only for three seconds to reposition myself. When the time reached its limit, the Huntres shoved his shadow-like dagger to the place where I was three seconds ago.",fear
I heard him chuckle and that made me smile a little. I like this side of him more.,joy
"""Yes. Maybe I should've told you this before. Maybe you wouldn't get yourself involved with me after this, and maybe your feelings toward me will disappear and turn into something else.""",sadness
"His dumbfounded expression was replaced with a contemptuous smile and my heart has suddenly increased its pace. I recalled the reactions involved in attraction and love and this is one of the markers, unless I was feeling fear.",joy
"""Save yourself,"" he suddenly said and that made me stop for a second. ""I can't swim and I'll just be a burden to you. So please, leave me here and save—""",sadness
"""Thank you for not letting me go. Thank you for letting me see your face after that endless darkness.""",joy
"""Because she's a bit different and somehow similar to me. I saw myself in her,"" he said and the way he looked at me made me jittery.",fear
"He didn't say anything but he gently pulled me toward him and the next thing I knew, he was already hugging me. My head was spinning and my heart was ready to burst any moment now but his warmth calmed me down.",joy
"""This is Shima, the island of the damned,"" he said and the cries and screams of agony of the people inhabiting it filled my ears.",fear
I moved closer to him since the atmosphere felt disturbing and I don't want to be alone in this kind of place.,fear
Consecutive roars from the huge lion and leopard in front greeted us and I was rendered motionless due to fear and confusion. Their bodies were twice larger than the normal ones and they looked more ferocious.,fear
"I almost forgot to breathe when he said that and I got more cautious because of the danger that this place could offer. Some of the plants and trees we passed by emit strange odor and chemicals that, according to him, could paralyze or cause hallucination.",fear
"All of a sudden, the two other guys grabbed both of my arms while the one who was speaking pointed his spear at Mitsuo.",fear
"""Mitsuo!"" I called, frightened by the situation. I wanted to reach my fan but I couldn't move my arms due to their strength.",fear
"""What are you doing, Lionel?"" Mitsuo snarled while glaring at the guy.",anger
"Lionel and Mitsuo both looked at me and I just wanted to go to his side. In this unfamiliar place and situation, Mitsuo was the only one I could depend on.",fear
"""I'm sorry,"" he said.",sadness
"The guys dragged me away from them and I could feel the stinging pain from where they were holding me. Instead of yelling at them, I observed the surrounding and I almost gasped when I saw the crimson-colored ground.",fear
"""Curse you, fucking Jikko!"" the guy yelled and he spat on the ground.",anger
"The Executioner swung his scythe and I immediately closed the window. The guy howled in anger but after a few seconds, it disappeared. My body convulsed, imaging the scenario that just happened outside.",fear
"I smiled at her and she looked at me with curiosity. She might be too young to understand the concept but still, I wanted to tell her.",joy
"""Don't involve yourself with him anymore,"" he said with his piercing gaze, his scythe pointed at my direction.",anger
My body went rigid when I heard my whole name from his mouth. How did he . . .,fear
"Panic started to arise in my body as the volcanic ash and other matter coming out of the volcano. I ran towards the door, pounding it and screaming for help, but my voice was masked by the mass outcry happening inside my head.",fear
"""How dare you do this to me, Senshins! I'm going to kill all of you! Watch me!"" the woman screamed while vultures, crows and ravens circled around her, her naked body covered with cuts and wounds.",anger
"I clutched my stomach when I saw the vultures lunging at her wounds, as if they were hastening her death. One of the crows targeted her eyes and I instinctively closed my eyes, imagining the scenario if it was me in her place.",fear
Her wails and curses filled the air but my eyes flung open when I realized the owner of that voice—it was the Huntres we encountered on the sea.,fear
"""STOP! NO!"" the Huntres shrieked. ""I didn't mean it! Believe me! Please!""",fear
"I suddenly felt scared because unfamiliar memories were starting to fill and overwrite my mind and for a second, I couldn't remember my own memories anymore.",fear
"""For what reason?!"" I pointed my fan at his direction and the memories I was trying to remember a while ago were becoming vivid.",anger
I wanted to stop reading his memories but I found myself still looking through them until my parents' death. I clutched my chest because it felt like my heart would burst any second.,sadness
"""You disgust me,"" I said. ""How dare you question my parents' and our clan's loyalty when all they did was support the President!""",anger
"""It wasn't! Sir Hideyoshi treasured them as friends, and yet because of your doubts, he lost them . . . I lost them.""",anger
"His words stung like poison and I couldn't take it anymore. I swung my fan at his direction, ready to slit his throat, but something restricted my hand.",anger
"When I saw him, the remaining strength I was holding onto dissolved and triggered my tears. He pulled me into his chest and I cried my heart out.",sadness
"""Don't leave me here,"" I said, scared to lose my own thoughts again.",fear
"""All of the people here, the prisoners and even the Executioners, have their own share of madness. I thought I can protect you but I haven't considered your ability. It must've been hard for you. I'm sorry.",sadness
And I thought I was doing a great job of keeping it at the back of my mind.,sadness
Why are you crying?,sadness
"""It's just that . . . I don't know how to face Hideo anymore,"" I said while remembering our childhood.",sadness
"""I'm sorry for not telling you the truth,"" he said, breaking the silence.",sadness
"My tears automatically fell after hearing those words, remembering the hardships my parents went through because of the Council's ideas.",sadness
"""Why?"" I asked, trying my best to stay calm even if my face and mind were already a mess.",sadness
"""From the bottom of my heart, I am sorry for hurting you like this,"" he said while bowing for apology",sadness
"""I'm sorry for not knowing the truth until now,"" I said with a shaky voice.",sadness
"""I lived in solace while you were wrongly judged and killed. I'm sorry.""",sadness
"""But you know, it's nice that you're back,"" Michiko suddenly said while looking at Mitsuo.",joy
"""We already know about Shima after that jailbreak incident,"" Mayu added.",sadness
"""But you made her suffer,"" Hideo said and that made us silent.",sadness
"I'm really lucky to have these people in my life. To me, they are my family.",joy
"""Hideo . . ."" I checked him and he seemed troubled. ""Calm yourself.""",fear
"""No one's leaving this place,"" Hideo warned and his eyes found her.",fear
"""I am done with all of you so stop this bullshit,"" she harshly said but I could read her mind.",anger
"""Yes,"" I breathed. I was afraid not for myself but for the life inside me. I do not know what to do.",fear
"""I'm sorry,"" he whispered.",sadness
I am not worthy to be someone's father. I don't deserve this. I—,sadness
But it's the truth. My hands were already soaked in people's blood. I've killed hundreds of people. Someone as filthy as me can't have something so pure.,sadness
"""No. Sorry,"" he said and he hugged me.",sadness
"""It's just that . . . I don't want the both of you to be labeled as an Executioner's wife and child. But I'll do anything to protect you so you don't need to worry. I made this choice so I will do anything to keep you out of danger.""",sadness
"Suddenly, I imagined the three of us walking together, our child in his arms while I look at them happily. It made me satisfied.",joy
"Yes, for he is the greatest gift you have given me, and a reminder that he should protect you when I'm not around.",joy
"""I hope we could attend this festival next year together with Nathan,"" I said and he just smiled.",joy
"""Me too."" A smile was formed on my lips, ""maybe she wants a younger brother and I think she's really good at taking care of others.""",joy
"""I'm sorry for giving this kind of task to you,"" he said in an apologetic tone.",sadness
I promised that I wouldn't cry anymore after giving birth to Nathan but his words were stirring up my emotions.,sadness
"""Of course,"" I said. ""We've been helping each other since we were young. You don't need to worry.""",joy
"""I don't want him to be labeled as an Executioner's child.""",sadness
"""What's happening?"" I asked and I could sense the panic in my own voice.",fear
"""That's the warning for intruders,"" he said and he stood up.",fear
"""What in the world . . ."" My voice disappeared after seeing the room in front of me.",fear
"""The hallway . . ."" My voice dissolved into thin air when I saw Vince's expression.",fear
I don't know the exact details but I'm sure it was the Black Dimension.,fear
He's . . . in a state of coma.,fear
"""He's now fine but he needs rest,"" she said and I could see the tinge of guilt in her eyes. ""You should rest, too.""",joy
"""It suits you,"" I said and he gave me a confused look, ""being a father, I mean.""",joy
"""Stupid,"" I muttered while trying hard not to cry. ""That was the best thing I've heard these past few weeks.""",joy
"For a second, I was tempted to stop the time just to look at my family—the two guys who changed my world.",joy
I stayed alert after she said that since our last encounter didn't go well.,fear
I'm scared.,fear
"""Oh God. You're really here, Akemi.""",joy
"""Rainie,"" she said with a smile. ""How about your son?""",joy
"Naomi, please. I need to see him. I want to see him. Please.",sadness
"""But I can say that you deserve to die because you said those things. Talk bad about her and you'll die by my hands.""",anger
"""Idiot. Don't say that.""",anger
"""Naomi, you don't have to do this,""Akemi said. ""You have your own family to protect, so please . .""",sadness
Hideo! Please help him. Please—,sadness
"""Don't touch them!"" I yelled.",anger
"""I know you need to go to Akemi, but I have a favor to ask."" Nathan started crying and he was holding onto his father's clothes.",sadness
"""Sorry Nathan. Take care of your mother for me.""",sadness
"""No . . . Vince . . . don't say that . . .""",sadness
"""I'm here. You should calm down and think carefully. You're safe so you do not need to worry."" Those were the meanings of his knocks.",joy
"But I'm sorry, Nathalie, I don't think I can save you",sadness
"""Sorry.""",sadness
"Don't say that! Please, don't say that.",sadness
"""Please, just forget me,"" he weakly said. ""Use my sixth sense, Nathalie.""",sadness
What are you saying?,sadness
I don't want to cause you more pain.,sadness
Are you stupid? I'd rather live in pain than forget you.,sadness
How could he say those words to me? How could he say that I should forget him?,sadness
But I . . . but I can't live with you anymore and I'll hurt you even more.,sadness
