sentence,emotion
"""It's time to start this war,"" I declared. ""Inform all our allies. In a few months, we will attack the White Division. We will reclaim what's ours and I will end this tragic fire.""",anger
"""Mom, Dad,"" I whispered as I stared at the only family photo we had. ""I can finally avenge your death.""",sadness
"""If you can kill me."" I stomped my right foot and the flame surrounding him froze. ""And now, I will take back everything you have stolen from me.""",anger
"""Fellow comrades and allies!"" I roared as I glared at Pierre.",anger
"""I will do everything to reclaim our place, our honor and the peace between the Huntres' divisions,"" I seethed, ""even if it means killing you and your followers.""",anger
"""Don't underestimate my fire, brat.""",anger
"""Don't die. Please.""",sadness
"""I'm sorry . . . Glace,""Dad groaned. ""G-go away and find our daughters. P-protect them.""",sadness
"""It's over . . ."" I mumbled. ""Mom . . . Dad . . . it's over . . .""",joy
"""If anything happens, I'll protect you with my life and I'll always be by your side. I'm sorry,"" I said as my voice cracked. ""I'm sorry breaking my promise. I'm sorry for leaving you all alone. Please forgive me.""",sadness
"""So, how did you meet them?"" I asked and her eyes twinkled.",joy
"""I'm sorry but I also have another family waiting for me.""",sadness
"""Don't you know how to knock?"" she growled.",anger
"And for the first time, I flashed a smile in front of a huge crowd.",joy
"""We're finally home,"" I softly said.",joy
"This time, I felt contentment and not anger.",joy
His bloodshot eyes looked at me with concern while Jett continued fiddling with his guns.,anger
The mood instantly went down after mentioning her name. I felt a pang of guilt and anger when I remembered what happened to her during the battle with Nox.,sadness
"As a Keeper, I was supposed to keep my team safe but she almost died because of my shortcomings.",sadness
"I never believed in gods but for the first time, I silently prayed. I just wanted to see her awake and okay before I go.",fear
I was about to go to the bathroom but I received a message from Commander Priam so I immediately went to his office.,fear
"""Agent Naia,"" he called. ""Are you sure you can handle this?""",sadness
"I nodded without a second thought. Only the leaders of the tribes have the authority to enter Shima from the outside but his hands were full with the aftermaths of the Nox's downfall. As someone who had lived there for quite some time, he asked me to bring the criminals to that place.",fear
"Truthfully, I was a bit surprised that he knew my past.",fear
"When I first arrived here, I was sure I modified my background to prevent them from knowing my connections with Shima. I was just thankful that he didn't ask anything about it.",joy
"""There are too many executives for you to escort and it will be too risky for you to handle them alone. Hence, this.""",fear
I stared at the device in awe. Senshins and Custos were really stepping up their game in this field.,sadness
"""Good luck and come back alive,"" he said and I saluted.",fear
I was admiring the device as I walked to my room when I saw a figure standing on the doorway.,joy
"""What? Do you want me to check that?"" I asked while pointing at the pistol on his waist band.",anger
Jett quietly followed me as I entered my room and he remained standing while I sat on the side of my bed.,fear
"""You're really going alone,"" he softly said. ""Yeah. Alone,"" I emphasized.",sadness
"Even though Cliff and Jett didn't say it out loud before, I knew they wanted to come with me, but it would be hard to travel with outsiders. I didn't want to risk their lives.",fear
"""No,"" I firmly said. ""You won't last a minute there.""",anger
"In a splitsecond, the tip of my sword came in contact with his neck and he stood still, a trickle of sweat running down his face.",fear
"""If you can't even defend yourself against that, then no.""",anger
"""that's unfair,"" he complained. ""I wasn't prepared.""",anger
"I sheathed my sword and smiled at him. ""The unprepared are the first to die,"" I said as I picked up my luggage. ""Don't miss me too much.""",sadness
I was ready to leave my room but halted when I heard him call my name.,fear
"""Naia."" Turning around, I caught the pistol he just threw at my direction. ""Keep safe."" A smile escaped my lips upon hearing that line.",joy
"I'm a Keeper, I said. ""I need to stay alive to keep my team from dying.""",anger
The smile on my face faded as I marched away from the place that sheltered me since I was young. It's time to return to the place of curses and chaos.,fear
"I had lost track of time as I drifted for days in the middle of the ocean. Fortunately, my supplies were still enough and the ocean was calm",joy
"Nel would surely be awake by now. I could imagine her angry face, questioning Cliff and Jett about me.",fear
A smile escaped my lips as I reminisced the life I had in CIA. It was never easy but it was less troubling than where I was headed.,joy
"Shima had been a subject of myths and rumors among Erityians. Many believed it was not real, until he met his demise.",sadness
"I could still remember that time, Executioners were ready to slaughter every Shinigami they had imprisoned, not minding the repercussions from the administration and the council.",fear
"Ise, then head of the Jikko clan, vowed to kill every single Shinigami who made his grandson suffer.",anger
"""Naia, you should never allow anyone to read your mind,"" Vince would always say when I was a child.",fear
"""Because they can use your thoughts and memories against you.""",fear
I heaved a sigh. It's been more than a decade since he died yet the pain still lingered inside me. I missed him.,sadness
"My thoughts returned to the present when the clear sky and water suddenly turned dark. In a span of a few seconds, everything was already covered in fog.",sadness
A wave of nostalgia hit me as I felt the fog brushed against my skin.,sadness
"As if on cue, the fog dissipated and the familiar island came into view. The silence I was enjoying a while ago was replaced by cries and screams of agony and pain..",sadness
The air was filled with metallic and putrid smell—the scent of bloodshed and death.,fear
"I smirked. ""Yeah. I thought you've already forgotten me.""",joy
A guy clad in black holding a huge scythe appeared in front of me. He still looked the same except for the additional creases on his face.,fear
"Farallon was never fazed with anything. Even when Vince brought her here, he remained inexpressive.",fear
"When Vince died, his face was expressionless but his eyes were gleaming with wrath.",anger
Seeing him after a long time made me feel like I was a kid again.,joy
How's everyone? I asked as I came ashore.,joy
Why are you here? he questioned without answering mine.,anger
"Despite his skepticism, he walked with me toward the forest. I heard the familiar roars of Shira and Hyora, the guardians and first line of defense of this island.",fear
"""Hey,"" I snickered as the lion and leopard made their way to me.",joy
I didn't have any friends of my age in this place and all the Executioners were busy with their jobs and missions so I befriended these two.,sadness
"Among the natives of this island, only me and Aristus could snuggle with these deadly predators.",joy
"""Everything has changed here,"" Farallon said as we passed through the forest.",sadness
It was always dark in the woods as the canopy of trees blocked the sunlight.,sadness
I remembered getting lost here when I was young and Farallon found me in a critical state.,sadness
My arms accidentally brushed against the leaves of a poisonous plant and rendered me motionless.,fear
The venomous insects buzzed around and the deadly plants' leaves fluttered in the wind.,fear
It took us a while to get out of the forest and the stretch of sludge came into view.,joy
"Farallon wounded himself, his blood trickling from his finger and it dropped onto the boulder at the forest's threshold.",sadness
The rancid smell was enough to make someone nauseous but it was already normal for the inhabitants of this island.,fear
"Some Executioners halted, others took a glance at me, as I walked beside Farallon. The older ones were able to recognize me as the child who had red eyes.",joy
"""Naia?"" One of the called. ""Is that you, Naia?""",joy
"""Yuma,"" I replied. ""You look old now.""",joy
"He drew his sword and I swiftly fended off his attack. Some Executioners gathered around, bellowing and cheering, as the two of us were caught in an onslaught.",fear
"He was still fast and agile despite his age. I could feel the cuts on my skin, blood streaming through my arms. I managed to land a gash on his cheeks and he looked more excited.",joy
"""Damn, child, you better not underestimate me,"" he beamed as he charged at me.",anger
"That moment, my skin tingled as I felt an intense bloodlust from him.",fear
"""The unprepared are the first to die.""",sadness
"I remembered what I told to Jett and cursed myself for being too softhearted. This was Shima, a place where comrades could kill one another without giving a thought.",fear
"He disappeared from my sight, and the next thing I knew, the tip of his blade was already piercing through my right shoulder.",anger
I gritted my teeth in pain and held his sword.,anger
I kicked his neck as I my hands bled while gripping his blade.,anger
The force made him lose his balance and grip on the sword and I immediately pulled it out of my flesh.,fear
Yuma sat up and laughed hysterically as he looked at me.,joy
"Shit, this is bad, he chuckled. ""I want to kill you now.""",anger
"He was ready to charged at me but everyone suddenly fell silent. I felt the immense pressure in the atmosphere, making my body tremble in fear.",fear
W-what was that? I mumbled.,fear
"Amidst the silence, I heard heavy footsteps approaching our direction. The Executioners gave way and I saw a hooded man walking toward us.",fear
The tattered cloak fluttered as the wind howled. Behind him was a woman who was eerily familiar. Then I remembered Nel's story about a Senshin who had the eyes of a Shinigami and a Custos.,fear
"As far as I remembered, Lionel should be the de-facto leader since Ise lost his only heir when Vince died. I was sure Lionel didn't look like that when I left Shima.",sadness
"""Child, state your name,"" he demanded and I flinched upon hearing his voice.",fear
"""I see. The child of Diona and Heron,"" he said and my stomach churned in distress as I heard my parents' names.",anger
He carefully removed his hood and I almost got paralyzed by his stare. Intense and cold green eyes looked right into mine.,fear
"""W-who are you?"" I asked, my voice shaking in fear.",fear
He bellowed in laughter as if my question was something funny.,anger
"""A Jikko branch clan member,"" he responded. ""That old fart didn't even talk to me until he needed someone to inherit his position.""",sadness
"Some Executioners were visibly uncomfortable after hearing him badmouthing Ise. I, too, felt annoyed as Ise was the most respectable person in this island.",anger
"""I vowed to hunt down every single Shinigami but they locked me up in this place""",anger
He seethed and I had to step back because his anger screamed danger.,fear
"""Damn that council of old and coward shitheads.""",anger
"""Dad, calm down,"" the woman behind him softly said.",fear
It had been three hours since I arrived in Shima yet I had already learned about what happened here after Ise and Vince died.,sadness
"Shira snuggled me and I could hear the guttural sound he was making, as if asking some attention.",sadness
"Man, you haven't change at all, I snickered while caressing his mane.",joy
I stayed at the shore of the island as they decide what to do with me and the prisoners I had to transfer using the Senshins and Custos technology.,fear
"Heaving a sigh, I stared at the endless sea.",sadness
I reached for my weapon as I turned my head around and saw that girl. Speaking of the devil.,fear
She walked toward my direction and Shira started snarling at her.,anger
"Calm down, boy, I said.",anger
The girl sat beside me and looked at the gray sky. She smiled and it felt so genuine that I let my guard down for a second.,joy
"""You know, when I first arrived here, I thought I was going to die. This time, for real""",fear
"""I, too, was bringing criminals from the Nox and Sir Hideo told me that I should brace myself when I set foot here. I thought it was because of this island's reputation. I thought it was because of this island's reputation.""",fear
She glanced at me and her eyes were so distracting. Her iridescent irises where beautiful and nauseating at the same time.,joy
"""I was attacked by the Executioners the moment I landed. I was a fighter, too, but their strength were on a different level. It felt like I was fighting a Huntres with an instinct of a Senshin. It was terrifying.""",fear
My lips curved upward. Hearing that compliment for the Jikko clan was uplifting.,joy
"""My plan was to leave the criminals, deliver a news, and go back to Tantei High, but everything changed when their leader came to meet me.""",fear
"""It must be shocking,"" I commented.",fear
"She chuckled in response. ""Not really. My Dad is strong and stubborn so deep in my heart, I knew he was still alive, despite being labeled as missing in the records of the Senshins.""",sadness
"The only ones we were told to be wary about in the Senshin tribe were the remnants of the Great Seven, and some of the professors.",fear
"""But I didn't expect to see him here. Dad never liked positions.""",anger
"""Well, he's still a Jikko,"" I said. ""And when . . . when Vince died, the main family had no heir to replace him as the future leader.""",sadness
"I glanced at her, my brows furrowed, unsure if I heard that right.",anger
Huh? What do you mean?,fear
That name triggered a certain memory. I remembered the woman Vince brought here when she returned for a while. It was just a brief time but she was the first friend I had.,sadness
I stifled a gasp upon hearing that. Vince and Nathalie? They . . . they had a child?,sadness
"Where are the criminals you are talking about? he asked, but it sounded like a demand.",anger
Maintaining my composure was difficult in front of this Kyo. His presence was enough to feel his superiority and strength.,fear
There were still pools of blood on the ground and vultures were quietly looming above us. Some of the Executioners were preparing a huge pot of boiling oil and setting up several bamboo stakes.,fear
"""Who's going to be tortured?""",anger
"The look on their faces was a mixture of nausea, confusion and anger",fear
"Despite their feet and hands being bound, few of them started attacking the people around . . . which was a wrong and dumb move.",anger
"""This one's mine!""",anger
"""Humdrums are, indeed, stupid.""",anger
"""Couple of Erityians, too.""",anger
"""How does that feel?"" Yuma taunted as he pointed his scythe to an Executive neck. ""Your members are being toyed by an 11-year old Jikko.""",anger
"""A traitor like you,"" Yuma said as the tip of his scythe digging through Eerie's skin, ""brings shame to the Senshin tribe.""",anger
"My skin crawled upon hearing that familiar voice and when I turned around, I saw Lionel walking toward our direction.",fear
"""I have finished cleaning the Rei level,"" he reported to Kyo.",joy
"""Good,"" Kyo responded and Lionel went to the Nox's direction. ""Reliable as ever,"" he commented.",joy
"""Of course,"" I said. ""He's been Vince's rival since they were young. Strength wise, he's probably second to you.""",sadness
"""You're right,"" he chuckled. ""But potential-wise, that brat is higher than him.""",joy
"I shuddered when I felt his presence getting stronger and I had to step back to not get overwhelmed. When I looked at him, his grin was nowhere to be found and it was replaced with a grim expression.",fear
"""Okay. I'll be counting on you.""",joy
He silently walked away and I was left alone. I wanted to contact the CIA but communication outside was forbidden in this island.,sadness
It's been 36 hours since I arrived here and I was still adjusting to the intensity of voices inside my head.,fear
My range had improved and I could now hear the cries and howls in the prisons. It was draining but I was used to this kind of exhaustion since I was a child.,joy
I suddenly remembered how Nathalie almost lost her memories before because of these voices.,sadness
That must be really scary.,fear
"Hearing a voice inside my head, which was neither a scream of pain nor cries from mind torture, made me flinch. Who . . . wait . . .",sadness
"Nathalie looked at my direction, a hint of surprise on her face, but after a few seconds, she smiled, as if she had finally recognized me.",joy
Then my eyes drifted to the guy beside him and I halted when I saw his face.,fear
"""This pisses me off,"" Kyo grumbled. ""It's like looking at those two brats' faces.""",anger
"Nathalie chuckled. ""I know what you mean, Sir Kyo. Well, Hideo raised him so he kinda got his personality.""",joy
"""You kid,"" he said while looking at the guy.",anger
Wow. He's got guts. I'll give him that.,anger
Kyo grinned as if he just found someone to toy with.,joy
"""Too much noise.""",anger
"""You probably should not stay here,"" I said and he looked at me. ""Seems like you have the same ability as Nathalie.""",anger
That was the first time I saw someone greatly affected by the thoughts and inner voices of people despite our capability to block them.,sadness
"""You can hear inner voices despite their closed minds, right?"" He nodded.",fear
"""You sure you can handle the agony and pain of the tortured? The heinous and brutal thoughts of the prisoners? The radical ways and thoughts of the executioners?""",fear
He winced before he could answer my questions. I knew it. Those voices must be causing a discomfort and pain on his mind.,sadness
I stared at him for a few seconds. I wasn't sure if he was confident or just foolish.,sadness
"Amid the silence, I could hear faint voices, screams of agony and desperation from the prisoners.",sadness
"Within a splitsecond, I drew my sword and swung it to his direction.",anger
"Shock and confusion came into his face, and he leapt back, avoiding a serious cut on his neck. I pulled back my sword and looked at him.",anger
"""Seems like your flight instincts have been honed,"" I remarked as blood trickled from his neck.",joy
"""But, kiddo, Jikkos are known for fighting, not evading. I guess you aren't ready to inherit that name yet.""",anger
My words seemed to struck a chord and the look on his eyes instantly changed.,fear
I was caught off-guard for a second because he looked exactly like Vince when he's pissed.,fear
"""Kiddo? You seem like just a few years older than me,"" he commented.",anger
"""I call everyone weaker than me a kiddo,"" I retorted, and somehow it felt good.",joy
I didn't know taunting someone who could talk back would be this entertaining since Jett and Cliff would always give up before I could enjoy the conversation.,joy
"Before his hand could reach for something behind him, I lunged at him and gripped his arm.",anger
"I snatched his gun as he fell on his back and pointed it at him. I fired two bullets on each side of his head, just a few inches from his ears.",anger
"""What? Did you life flash right before your eyes?"" I taunted.",joy
A smile escaped my lips as I remembered how they described Vince's death.,joy
"I felt an intense pressure behind us and when I turned around, Kyo and Nathalie was already walking toward our direction.",fear
"I glanced at the guy who just got up and kept glaring at me. ""He'd lose to Karim,"" I replied.",anger
"""Too slow. Too weak. Too emotional. Too self-centered. If I'm an Executioner, I won't offer my trust and loyalty to someone who can't even defend himself.""",anger
Kyo bellowed in laughter while Nathalie looked conflicted.,joy
"That kid's presence was overwhelming, maybe the most intense among the Executioners besides Kyo, but that wouldn't mean anything if his body couldn't keep up.",fear
"""No filters and sugarcoating, huh? I like that,"" Kyo commented.",joy
"I scoffed. ""I don't like toning down my words. A weak must know he's weak, otherwise, he'd be complacent.""",anger
"""Naia . . ."" Nathalie called, a look of worry flashed on her face.",fear
"""I'm sorry, Nathalie. I'm just saying the truth. Well then, I need to rest.""",sadness
I started walking away from them. Kyo was still chuckling but the two remained silent.,joy
"My words might be harsh but this place is harsher. His naivety would just cause more harm. If it was the other Executioners that challenged him, he'd be dead by now. He should have prepared himself before setting foot here.",fear
"I was on my way to my cabin when I saw Aristus standing near it. ""Aristus!"" I called as I ran toward his direction.",joy
"He smiled upon seeing me. ""Naia.""",joy
"""I just learned that you're here,"" he softly said. ""And also Nathalie . . . and his son.""",joy
"""I arrived yesterday and you just heard it today?"" I noted as I squinted my eyes. ""How many days did you spend inside your cave this time?""",anger
"He chuckled nervously. ""Uh, a week, I think?""",fear
"""Learning and writing our history is fun. You should try it,"" he remarked as his eyes twinkled in excitement.",joy
"His enthusiasm about it made me retch. Aristus is the weakest here in terms of physical abilities, but the Executioners respect his vast knowledge about our race.",joy
"Aristus smirked and glanced at the isolated part of the island, which was called blood chamber, because of the red-dyed ground due to the volcano and keimusho.",joy
"""Still as persuasive as ever, huh?""",anger
"Despite closing my mind, I could still hear voices inside my head as we got nearer.",fear
Nathalie and Hiro would probably lose their minds the moment they stepped into this chamber.,fear
The temperature in this place took up a notch and I started sweating profusely.,fear
I already took off my coat and tied my hair but Aristus seemed unaffected. How could he still look comfortable with that mantle covering his body? Damn monster.,anger
"I breathed deeply and willed myself to stay calm. ""Yeah. It's just . . . it's been a while since I last went here.""",anger
It became hotter as we descended and it felt like my skin and bones would just melt.,fear
I could also hear the screams and cries of the prisoners and it made my head throb in pain.,sadness
Blood was splattered across his face and his blonde hair was dyed with scarlet hues. His green eyes gleamed in the dimly lit space and my skin crawled when he smiled at us.,fear
"""Ah. I just finished questioning this one,"" he said as he lifted the guy by grabbing his hair.",anger
"""That's good,"" Aristus commented. ""I need more information.""",joy
"""I already know where that Custos is,"" Lionel said, smirking. ""Ah. I wonder what kind of punishment I should give him.""",anger
"I shuddered upon hearing his words. Dale was an elusive target, even for us, yet he was already thinking of how he could make his life miserable.",fear
This guy . . . he might be more frightening than Kyo. And those two are the current main force of the Jikko clan. I wonder if that kid could hold a candle to them.,fear
"""Really?"" I muttered as Farallon readied the boat",anger
"""That's the rule, kid,"" he said. ""You can't communicate with others within the island.""",anger
I was left alone in the middle of the sea and I realized there was a brewing storm nearby.,fear
"""Damn it,"" I muttered while getting the device the Commander gave me.",anger
"""Naia,"" he greeted. ""Good to hear from you. What happened?""",joy
"""The criminals have been transferred successfully, Commander,"" I reported.",sadness
Farallon still couldn't believe that those beasts could still remember me and I was the only one that could cuddle them.,joy
"""I heard you went to the blood chamber with Aristus,"" he said and my body almost trembled when I remembered what happened there.",fear
"""Yeah. It was like coming back from hell.""",fear
"He snickered. ""Right. Remember when you first went there? Vince had to get you away from that place because it triggered your eyes.""",joy
"Ise said I wasn't allowed to be in the blood chamber because I was still too young and weak, but I wanted to see it. Besides, I admire both Vince and Lionel, even vowing to be their apprentice, but they both dismissed me.",sadness
"Fortunately, Ise had already taught me how to conceal my presence and both of their attention were on the criminals so it was quite easy for me to follow..",joy
"I thought I was doing a good job, until something happened",fear
"I heard voices, several of them, crying and howling in agony and pain.",fear
My head felt like it would burst any minute.,fear
"When I was in the island, I never heard those voices that loud but upon stepping onto the blood chamber, I realized why they never allowed those who hadn't trained yet.",fear
"It slowed me down but I thought I could control my mind. However, something made it much more complicated.",fear
"The next thing I knew, he was already grinning menacingly at my direction. Everything happened so fast that I only realized my situation when I was already held by my neck.",fear
"As a kid, I was beyond terrified. The prisoner took me as a hostage.",fear
My neck was pressed between his chest and arms as my body dangled. The tip of the knife was digging through my cheeks and blood began to trickle down my face.,fear
I was terrified and I felt something was changing in my mind and body.,fear
